{
  "$schema": "https://json-schema.org/draft/2020-12/schema",
  "$id": "https://aion.local/schemas/evidence-trial-bundle-v2.json",
  "title": "AION offline evidence trial bundle v2",
  "type": "object",
  "additionalProperties": false,
  "required": [
    "contract_version",
    "bundle_id",
    "evaluation_time",
    "raw_artifacts",
    "evidence_objects",
    "claim_objects"
  ],
  "properties": {
    "contract_version": {"const": "aion-evidence-objects-v2"},
    "bundle_id": {
      "type": "string",
      "pattern": "^[A-Za-z0-9][A-Za-z0-9._:-]{0,127}$"
    },
    "evaluation_time": {
      "type": "string",
      "pattern": "^\\d{4}-\\d{2}-\\d{2}T\\d{2}:\\d{2}:\\d{2}Z$"
    },
    "raw_artifacts": {
      "type": "array",
      "minItems": 1,
      "maxItems": 200,
      "items": {"type": "object"}
    },
    "evidence_objects": {
      "type": "array",
      "minItems": 1,
      "maxItems": 500,
      "items": {"type": "object"}
    },
    "claim_objects": {
      "type": "array",
      "minItems": 1,
      "maxItems": 200,
      "items": {"type": "object"}
    }
  }
}
